DateTime	Source	Title	lang	search_keywords	Label	preprocessed_text	NounChunks	km_label
2019-09-20 10:15:17	UrduPoint	ضلعی انتظامیہ اور ڈسٹرکٹ ایجوکیشن اتھارٹی کے اشتراک سے کشمیری خواتین کے وقار کی بحالی اور ان سے اظہار یکجہتی کیلئے ریلی کا انعقاد	ur	1	Kashmir	ضلعی انتظامیہ ڈسٹرکٹ ایجوکیشن اتھارٹی اشتراک کشمیری خواتین وقار بحالی اظہار یکجہتی کیلئے ریلی انعقاد	['ضلعی انتظامیہ', 'ڈسٹرکٹ ایجوکیشن اتھارٹی', 'اشتراک', 'کشمیری خواتین', 'وقار', 'بحالی', 'اظہار', 'ریلی', 'انعقاد']	7
2019-09-20 10:25:15	UrduPoint	وکلاء کشمیری مسلمانوں سے اظہار یکجہتی کیلئے 23 ستمبر کو کنونشن اور ریلی کا انعقاد کریں گے، محمد ارشد اعوان ایڈووکیٹ	ur	1	Kashmir	وکلاء کشمیری مسلمانوں اظہار یکجہتی کیلئے ستمبر کنونشن ریلی انعقاد محمد ارشد اعوان ایڈووکیٹ	['وکلاء', 'کشمیری مسلمانوں', 'اظہار', 'ستمبر', 'کنونشن', 'ریلی', 'انعقاد', 'محمد ارشد اعوان ایڈووکیٹ']	7
2019-09-20 10:35:21	UrduPoint	ہرنائی میں کشمیریوں سے اظہار یکجہتی ریلی،احتجاجی مظاہرہ	ur	1	Kashmir	ہرنائی کشمیریوں اظہار یکجہتی ریلی احتجاجی مظاہرہ	['ہرنائی', 'کشمیریوں', 'اظہار یکجہتی', 'ریلیاحتجاجی مظاہرہ']	7
2019-09-20 10:49:09	UrduPoint	مقبوضہ کشمیر کی مظلوم و محکوم کشمیری خواتین کے ساتھ اظہار یکجہتی کے لیے محکمہ ترقی نسواں کے زیر اہتمام یکجہتی ریلی کا انعقاد	ur	1	Kashmir	مقبوضہ کشمیر مظلوم و محکوم کشمیری خواتین اظہار یکجہتی محکمہ ترقی نسواں زیر اہتمام یکجہتی ریلی انعقاد	['مقبوضہ کشمیر', 'مظلوم', 'محکوم', 'کشمیری خواتین', 'ساتھ اظہار یکجہتی', 'محکمہ ترقی نسواں', 'زیر اہتمام یکجہتی ریلی', 'انعقاد']	7
2019-09-20 11:50:23	UrduPoint	ڈیرہ مرادجمالی میں کشمیریوں سے اظہار یکجہتی کیلئے ریلی نکالی گئی	ur	1	Kashmir	ڈیرہ مرادجمالی کشمیریوں اظہار یکجہتی کیلئے ریلی نکالی	['ڈیرہ مرادجمالی', 'کشمیریوں', 'اظہار', 'ریلی']	7
2019-09-20 13:02:41	UrduPoint	شیخوپورہ ،ضلعی انتظامیہ کے زیر اہتمام کشمیری بھائیوں سے اظہار یکجہتی اور بھارتی مظالم کیخلاف سیمینار اور خواتین کی ریلی کا انعقاد کیا گیا	ur	1	Kashmir	شیخوپورہ ضلعی انتظامیہ زیر اہتمام کشمیری بھائیوں اظہار یکجہتی بھارتی مظالم کیخلاف سیمینار خواتین ریلی انعقاد	['شیخوپورہ', 'ضلعی انتظامیہ', 'زیر اہتمام', 'کشمیری بھائیوں', 'اظہار یکجہتی', 'بھارتی مظالم', 'کیخلاف سیمینار', 'خواتین', 'ریلی', 'انعقاد']	7
2019-09-20 13:46:35	UrduPoint	"کشمیر پاکستانیوں کی رگوں میں خون کی طرح دو ڑتا ہے ،مسرت جمشید چیمہ 

چیئر پرسن قائمہ کمیٹی داخلہ کی قیادت میں کاشانہ ہوم کی بچیوں نے کشمیریوں سے اظہار یکجہتی کیلئے ریلی ... مزید"	ur	1	Kashmir	کشمیر پاکستانیوں رگوں خون ڑتا مسرت جمشید چیمہ چیئر پرسن قائمہ کمیٹی داخلہ قیادت کاشانہ ہوم بچیوں کشمیریوں اظہار یکجہتی کیلئے ریلی	['کشمیر پاکستانیوں', 'رگوں', 'خون', 'طرح', 'مسرت جمشید چیمہ چیئر پرسن قائمہ کمیٹی داخلہ', 'قیادت', 'کاشانہ ہوم', 'بچیوں', 'کشمیریوں', 'اظہار', 'ریلی']	7
2019-09-20 13:59:49	UrduPoint	مظفرگڑھ,کشمیری عوام سے اظہار یکجہتی کیلئی ریلیاں نکالی گئیں	ur	1	Kashmir	مظفرگڑھ کشمیری عوام اظہار یکجہتی کیلئی ریلیاں نکالی گئیں	['مظفرگڑھکشمیری عوام', 'اظہار یکجہتی', 'کیلئی ریلیاں']	7
2019-09-20 13:59:49	UrduPoint	"کشمیریوں سے اظہار یکجہتی ہم سب پر لازمی ہے، عبدالوسیم 
پاکستان کی سلامی پر ہماری زندگی قربان ہے، شرف الدین"	ur	1	Kashmir	کشمیریوں اظہار یکجہتی لازمی عبدالوسیم پاکستان سلامی زندگی قربان شرف الدین	['کشمیریوں', 'اظہار یکجہتی', 'عبدالوسیم پاکستان', 'سلامی', 'زندگی', 'شرف الدین']	7
2019-09-20 14:13:04	UrduPoint	مقبوضہ کشمیر کی خواتین سے اظہار یکجہتی کے لئے گورنمنٹ گرلزکالج وہاڑی  سے ریلی نکا لی گئی	ur	1	Kashmir	مقبوضہ کشمیر خواتین اظہار یکجہتی گورنمنٹ گرلزکالج وہاڑی ریلی نکا	['مقبوضہ کشمیر', 'خواتین', 'اظہار یکجہتی', 'لئے گورنمنٹ گرلزکالج وہاڑی', 'ریلی']	7
2019-09-20 14:13:04	UrduPoint	کشمیریوں کے ساتھ اظہار یکجہتی کیلئے پوری قوم اٹھ کھڑی ہے،رانا شکیل احمد	ur	1	Kashmir	کشمیریوں اظہار یکجہتی کیلئے قوم اٹھ کھڑی رانا شکیل احمد	['کشمیریوں', 'ساتھ اظہار یکجہتی', 'پوری قوم', 'کھڑی ہےرانا شکیل احمد']	7
2019-09-20 14:19:24	UrduPoint	کشمیریوں سے اظہار یکجہتی کیلیے شعبہ خواتین کشمیر کمیٹی کے زیر اہتمام پاکپتن میں ریلی کا انعقاد	ur	1	Kashmir	کشمیریوں اظہار یکجہتی کیلیے شعبہ خواتین کشمیر کمیٹی زیر اہتمام پاکپتن ریلی انعقاد	['کشمیریوں', 'اظہار یکجہتی', 'شعبہ خواتین', 'کشمیر کمیٹی', 'زیر اہتمام پاکپتن', 'ریلی', 'انعقاد']	7
2019-09-20 14:28:17	UrduPoint	کوہلو ،کشمیریوں سے اظہار یکجہتی کیلئے ریلی نکالی گئی	ur	1	Kashmir	کوہلو کشمیریوں اظہار یکجہتی کیلئے ریلی نکالی	['کوہلو کشمیریوں', 'اظہار', 'ریلی']	7
2019-09-20 15:36:08	UrduPoint	نصیرآباد:ڈیرہ مرادجمالی میں کشمیریوں سے اظہار یکجہتی اور پاک فوج کے حق میں قبائلی رہنماء وڈیرہ عرض محمد جتک کی قیادت میں جتک ہاوس سے ریلی	ur	1	Kashmir	نصیرآباد ڈیرہ مرادجمالی کشمیریوں اظہار یکجہتی پاک فوج حق قبائلی رہنماء وڈیرہ عرض محمد جتک قیادت جتک ہاوس ریلی	['نصیرآبادڈیرہ مرادجمالی', 'کشمیریوں', 'اظہار یکجہتی', 'پاک فوج', 'حق', 'قبائلی رہنماء', 'وڈیرہ عرض محمد جتک', 'قیادت', 'جتک ہاوس', 'ریلی']	7
2019-09-20 15:53:37	UrduPoint	الپوری:ضلع بھر میں بھی مختلف تنظیموں،مذہبی وسیاسی جماعتوں ، مختلف سکولوں، کالجوں کے طلباء۔ انجمن تاجران کا کشمیریوں سے اظہار یکجہتی کے حوالے سے ریلیاں اوراحتجاجی مظاہرے	ur	1	Kashmir	الپوری ضلع مختلف تنظیموں مذہبی وسیاسی جماعتوں مختلف سکولوں کالجوں طلباء انجمن تاجران کشمیریوں اظہار یکجہتی حوالے ریلیاں اوراحتجاجی مظاہرے	['الپوریضلع', 'مختلف تنظیموںمذہبی', 'وسیاسی جماعتوں', 'مختلف سکولوں کالجوں', 'طلباء۔ انجمن تاجران', 'کشمیریوں', 'اظہار یکجہتی', 'حوالے', 'ریلیاں', 'اوراحتجاجی مظاہرے']	7
2019-09-20 17:10:22	UrduPoint	ڈپٹی کمشنر صحبت پور محمد یونس سنجرانی کی قیادت میںکشمیر کے مظلوم بھائیوں سے اظہار یکجہتی کیلئے ریلی کا انعقاد	ur	1	Kashmir	ڈپٹی کمشنر صحبت پور محمد یونس سنجرانی قیادت میںکشمیر مظلوم بھائیوں اظہار یکجہتی کیلئے ریلی انعقاد	['ڈپٹی کمشنر صحبت پور محمد یونس سنجرانی', 'قیادت میںکشمیر', 'مظلوم بھائیوں', 'اظہار', 'ریلی', 'انعقاد']	7
2019-09-20 17:10:23	UrduPoint	کمشنر سبی ڈویژن سید فیصل احمد کی قیادت میں کشمیریوں سے اظہار یکجہتی کے حوالے سے ریلی کا انعقاد	ur	1	Kashmir	کمشنر سبی ڈویژن سید فیصل احمد قیادت کشمیریوں اظہار یکجہتی حوالے ریلی انعقاد	['کمشنر سبی ڈویژن سید فیصل احمد', 'قیادت', 'کشمیریوں', 'اظہار یکجہتی', 'حوالے', 'ریلی', 'انعقاد']	7
2019-09-20 17:20:57	UrduPoint	"مرکزی علماء کونسل کی اپیل پر کشمیریوں سے اظہار یکجہتی کیلئے ملک بھرمیں’’یوم ندائے کشمیر‘‘ منایا گیا

جمعہ کے اجتماعات میں مقبوضہ کشمیر میں بھارتی مظالم کیخلاف مذمتی ... مزید"	ur	1	Kashmir	مرکزی علماء کونسل اپیل کشمیریوں اظہار یکجہتی کیلئے ملک بھرمیں یوم ندائے کشمیر منایا جمعہ اجتماعات مقبوضہ کشمیر بھارتی مظالم کیخلاف مذمتی	['مرکزی علماء کونسل', 'اپیل', 'کشمیریوں', 'اظہار', 'ملک بھرمیں’’یوم ندائے کشمیر', 'جمعہ', 'اجتماعات', 'مقبوضہ کشمیر', 'بھارتی مظالم کیخلاف مذمتی']	7
2019-09-20 17:35:18	UrduPoint	گورنمنٹ ڈگری کالج سکھر میں کشمیری عوام کیساتھ اظہار یکجہتی کیلئے ریلی	ur	1	Kashmir	گورنمنٹ ڈگری کالج سکھر کشمیری عوام کیساتھ اظہار یکجہتی کیلئے ریلی	['گورنمنٹ ڈگری کالج سکھر', 'کشمیری عوام کیساتھ اظہار یکجہتی', 'ریلی']	7
2019-09-22 18:10:19	UrduPoint	"کشمیر کمیٹی کراچی کے تحت کشمیریوں سے اظہار یکجہتی کے لیے عظیم الشان موٹر سائیکل ریلی نکالی گئی، شہریوں کی بڑی تعداد کی شرکت 
دنیا کی کوئی طاقت کشمیری حریت پسندوں کی حمایت ... مزید"	ur	1	Kashmir	کشمیر کمیٹی کراچی کشمیریوں اظہار یکجہتی عظیم الشان موٹر سائیکل ریلی نکالی شہریوں تعداد شرکت دنیا طاقت کشمیری حریت پسندوں حمایت	['کشمیر کمیٹی کراچی', 'تحت کشمیریوں', 'اظہار یکجہتی', 'عظیم الشان موٹر سائیکل ریلی', 'شہریوں', 'بڑی تعداد', 'شرکت دنیا', 'طاقت کشمیری حریت پسندوں', 'حمایت']	7
2019-09-23 10:28:10	ExpressNews	اظہار یکجہتی یا دکھاوا؟	ur	1	Kashmir	اظہار یکجہتی دکھاوا	['اظہار یکجہتی', 'دکھاوا؟']	7
2019-10-07 13:59:17	UrduPoint	پشین ۔پشین میں کشمیری عوام کے ساتھ اظہار یکجہتی کیلئے تحریک جوانان پاکستان کے زیر اہتمام ریلی کا انعقاد	ur	1	Kashmir	پشین پشین کشمیری عوام اظہار یکجہتی کیلئے تحریک جوانان پاکستان زیر اہتمام ریلی انعقاد	['پشین ۔پشین', 'کشمیری عوام', 'ساتھ اظہار', 'تحریک جوانان پاکستان', 'زیر اہتمام ریلی', 'انعقاد']	7
2019-10-08 19:10:34	UrduPoint	"وزیر اعظم عمران خان نے مسئلہ کشمیر کو بین الاقوامی فورم پر حقیقی جذبے سے اجاگر کیا ہے ، نورالحق قادری
وفاقی وزیر برائے مذہبی امور کاکشمیریوں کے ساتھ اظہار یکجہتی کے لئے ... مزید"	ur	1	Kashmir	وزیر اعظم عمران خان مسئلہ کشمیر بین الاقوامی فورم حقیقی جذبے اجاگر نورالحق قادری وفاقی وزیر برائے مذہبی امور کاکشمیریوں اظہار یکجہتی	['وزیر اعظم عمران خان', 'مسئلہ کشمیر', 'بین الاقوامی فورم', 'حقیقی جذبے', 'نورالحق قادری', 'وفاقی وزیر', 'مذہبی امور کاکشمیریوں', 'ساتھ اظہار یکجہتی', 'لئے']	4
2019-10-10 08:39:15	UrduPoint	گلوکارہ رابی پیر زادہ نے کشمیری بھائیوں سے اظہار یکجہتی کیلئے نیا گانا ریکارڈ کر کے سوشل میڈیا پر اپ لوڈ کردیا	ur	1	Kashmir	گلوکارہ رابی پیر زادہ کشمیری بھائیوں اظہار یکجہتی کیلئے نیا گانا ریکارڈ سوشل میڈیا لوڈ	['گلوکارہ رابی پیر زادہ', 'کشمیری بھائیوں', 'اظہار یکجہتی', 'نیا گانا ریکارڈ', 'سوشل میڈیا', 'اپ لوڈ']	7
2019-10-10 09:52:12	UrduPoint	صدر جے آئی یوتھ چناری دھرنا مظاہرین سے اظہار یکجہتی کیلئے چناری پہنچ گئے‘دھرنے کا بھرپور استقبال	ur	1	Kashmir	صدر جے آئی یوتھ چناری دھرنا مظاہرین اظہار یکجہتی کیلئے چناری پہنچ دھرنے بھرپور استقبال	['صدر جے آئی یوتھ چناری', 'مظاہرین', 'اظہار', 'چناری', 'بھرپور استقبال']	7
2019-10-10 13:20:43	ExpressNews	کشمیریوں سے اظہار یکجہتی؛حکومت کا اسلام آباد میں انسانی ہاتھوں کی زنجیر بنانے کا اعلان	ur	1	Kashmir	کشمیریوں اظہار یکجہتی حکومت اسلام آباد انسانی ہاتھوں زنجیر بنانے اعلان	['کشمیریوں', 'اظہار یکجہتی؛حکومت', 'اسلام', 'انسانی ہاتھوں', 'زنجیر', 'اعلان']	7
2019-10-10 15:32:15	UrduPoint	"مقبوضہ جموں کشمیر کے مظلوموں کے ساتھ اظہار یکجہتی کے لئے (کل )اسلام آباد میں انسانی ہاتھوں کی زنجیر بنائی جائے گی، ڈاکٹر فردوس عاشق اعوان

سہ پہر 3 بجے ایکسپریس چوک سے ... مزید"	ur	1	Kashmir	مقبوضہ جموں کشمیر مظلوموں اظہار یکجہتی کل اسلام آباد انسانی ہاتھوں زنجیر بنائی ڈاکٹر فردوس عاشق اعوان سہ پہر بجے ایکسپریس چوک	['مقبوضہ جموں کشمیر', 'مظلوموں', 'ساتھ اظہار یکجہتی', 'لئے', 'اسلام آباد', 'انسانی ہاتھوں', 'زنجیر', 'ڈاکٹر فردوس', 'عاشق اعوان', 'پہر بجے ایکسپریس چوک']	6
2019-10-10 17:00:35	UrduPoint	حیدرآباد کے شہری 13اکتوبر کو کشمیر مارچ میں بھرپور شرکت کرکے کشمیر کے مظلوم عوام سے اظہار یکجہتی کریں گے‘ حافظ طاہر مجید	ur	1	Kashmir	حیدر آباد شہری اکتوبر کشمیر مارچ بھرپور شرکت کشمیر مظلوم عوام اظہار یکجہتی حافظ طاہر مجید	['حیدرآباد', 'شہری اکتوبر', 'کشمیر مارچ', 'بھرپور شرکت کرکے کشمیر', 'مظلوم عوام', 'اظہار یکجہتی', 'حافظ', 'طاہر مجید']	7
2019-10-10 18:54:29	UrduPoint	"نواز شریف کو چوہدری شوگر مل کیس میں گرفتار کیے جانے کا امکان 

ن) لیگ نے رہنمائوں اور کارکنوں کو ممکنہ پیشی کے موقع پر اظہار یکجہتی کیلئے عدالت کے باہر پہنچنے کی ہدایت ... مزید"	ur	1	Kashmir	نواز شریف چوہدری شوگر کیس گرفتار امکان ن لیگ رہنمائوں کارکنوں ممکنہ پیشی موقع اظہار یکجہتی کیلئے عدالت پہنچنے ہدایت	['نواز', 'چوہدری شوگر', 'کیس', 'امکان ن لیگ', 'رہنمائوں', 'کارکنوں', 'ممکنہ پیشی', 'موقع', 'اظہار', 'عدالت', 'باہر', 'ہدایت']	7
2019-10-11 07:48:55	UrduPoint	کشمیریوں سے اظہار یکجہتی کے لئے 27 اکتوبر کو یوم سیاہ منایا جائے گا، وزارت داخلہ کی طرف سے نوٹیفکیشن جاری	ur	1	Kashmir	کشمیریوں اظہار یکجہتی اکتوبر یوم سیاہ منایا وزارت داخلہ نوٹیفکیشن جاری	['کشمیریوں', 'اظہار یکجہتی', 'لئے اکتوبر', 'یوم', 'وزارت داخلہ', 'طرف', 'نوٹیفکیشن']	7
2019-09-21 06:02:38	ExpressNews	پاک سری لنکن ٹی ٹوئنٹی سیریز؛ ٹکٹوں کی فروخت شروع	ur	1	PakSrilanka	پاک سری لنکن ٹی ٹوئنٹی سیریز ٹکٹوں فروخت شروع	['پاک سری لنکن ٹی ٹوئنٹی سیریز؛ ٹکٹوں', 'فروخت شروع']	8
2019-09-21 06:02:38	UrduPoint	پاک سری لنکن ٹی ٹوئنٹی سیریز؛ ٹکٹوں کی فروخت شروع	ur	1	PakSrilanka	پاک سری لنکن ٹی ٹوئنٹی سیریز ٹکٹوں فروخت شروع	['پاک سری لنکن ٹی ٹوئنٹی سیریز؛ ٹکٹوں', 'فروخت شروع']	8
2019-09-24 04:20:20	ExpressNews	سری لنکنز کا استقبال، کراچی نے بانہیں پھیلا دیں	ur	1	PakSrilanka	سری لنکنز استقبال کراچی بان پھیلا	['سری لنکنز', 'استقبال کراچی', 'بانہیں']	8
2019-10-07 15:54:46	UrduPoint	"انشاء اللہ انگلینڈ کی ٹیم جلد اور ضرور پاکستان کا دورہ کرے گی
پاکستان میں بین الاقوامی کرکٹ بحال ہونی چاہیئے، سری لنکن ٹیم کا دورہ خوش آئندہ ہے: انگلش لیگ اسپنر عادل رشید"	ur	1	PakSrilanka	انشاء اللہ انگلینڈ ٹیم جلد ضرور پاکستان دورہ پاکستان بین الاقوامی کرکٹ بحال سری لنکن ٹیم دورہ خوش آئندہ انگلش لیگ اسپنر عادل رشید	['انشاء اللہ انگلینڈ', 'ٹیم جلد', 'پاکستان', 'دورہ', 'پاکستان', 'بین الاقوامی کرکٹ', 'سری لنکن ٹیم', 'دورہ', 'انگلش لیگ اسپنر عادل رشید']	8
2019-10-07 17:00:44	UrduPoint	"پاک سری لنکن ٹی ٹونٹی کرکٹ سیریز ، سکیورٹی کے حسب معمول سخت اقدمات کئے گئے

قذافی سٹیڈیم کی جانب آنے والی تمام سڑکوں کو دوپہر دو بجے ہر قسم کی ٹریفک کے لئے بند کردیا گیادوپہر ... مزید"	ur	1	PakSrilanka	پاک سری لنکن ٹی ٹونٹی کرکٹ سیریز سکیورٹی حسب معمول سخت اقدمات قذافی سٹیڈیم جانب آنے سڑکوں دوپہر بجے قسم ٹریفک گیادوپہر	['پاک سری لنکن ٹی ٹونٹی کرکٹ سیریز سکیورٹی', 'حسب معمول', 'سخت اقدمات', 'قذافی سٹیڈیم', 'جانب', 'سڑکوں', 'دوپہر', 'بجے', 'قسم', 'ٹریفک', 'لئے', 'گیادوپہر']	8
2019-10-07 19:55:15	UrduPoint	ٹیم کی ہارپر جواب دہ ہوں‘ سری لنکن ٹیم نے بائولنگ ‘ بیٹنگ میں اچھی پرفارمنس دی‘ ہم دونوں شعبوں میں مکمل فیل ہوئے‘ ہار کے بعد ٹیم میں خامیوں کا پتہ چل گیا ‘ مضبوط ٹیم بنانے ... مزید	ur	1	PakSrilanka	ٹیم ہارپر اب دہ سری لنکن ٹیم بائولنگ بیٹنگ اچھی پرفارمنس شعبوں فیل ہار ٹیم خامیوں پتہ چل مضبوط ٹیم بنانے	['ٹیم', 'ہارپر جواب', 'سری لنکن ٹیم', 'بائولنگ بیٹنگ', 'اچھی پرفارمنس', 'شعبوں', 'ہار', 'بعد ٹیم', 'خامیوں', 'پتہ', 'مضبوط ٹیم']	8
2019-10-08 04:50:20	UrduPoint	پاکستان اور سری لنکا کے درمیان تیسرا اور آخری ٹی ٹونٹی انٹرنیشنل کرکٹ میچ (آج) کھیلا جائے گا، سری لنکن ٹیم کو پاکستان کے خلاف سیریز میں 2-0 کی فیصلہ کن برتری حاصل، مہمان ... مزید	ur	1	PakSrilanka	پاکستان سری لنکا تیسرا آخری ٹی ٹونٹی انٹرنیشنل کرکٹ میچ آج کھیلا سری لنکن ٹیم پاکستان سیریز فیصلہ کن برتری مہم	['پاکستان', 'سری لنکا', 'درمیان', 'آخری ٹی ٹونٹی انٹرنیشنل کرکٹ میچ آج', 'سری لنکن ٹیم', 'پاکستان', 'خلاف سیریز', 'فیصلہ', 'برتری', 'حاصل مہمان']	8
2019-10-08 08:58:45	UrduPoint	"پاکستان اور سری لنکن کی کرکٹ ٹیموں کے درمیان تیسرا اور آخری ٹی ٹوئنٹی میچ کل کھیلا جائیگا 
میچ شام 6 بجکر 30 منٹ پر شروع ہوگا،برقی قمقموں کی روشنی میں کھیلا جائیگا، سری ... مزید"	ur	1	PakSrilanka	پاکستان سری لنکن کرکٹ ٹیموں تیسرا آخری ٹی ٹوئنٹی میچ کل کھیلا جائیگا میچ شام بجکر منٹ شروع برقی قمقموں روشنی کھیلا جائیگا سری	['پاکستان', 'سری لنکن', 'کرکٹ ٹیموں', 'درمیان', 'آخری ٹی ٹوئنٹی میچ', 'میچ شام بجکر منٹ', 'شروع', 'ہوگابرقی قمقموں', 'روشنی', 'سری']	8
2019-10-08 15:11:43	UrduPoint	پاک سری لنکن ٹی ٹونٹی کرکٹ سیریز کا تیسرا اور آخری میچ کل کھیلا جائے گا	ur	1	PakSrilanka	پاک سری لنکن ٹی ٹونٹی کرکٹ سیریز تیسرا آخری میچ کل کھیلا	['پاک سری لنکن ٹی ٹونٹی کرکٹ سیریز', 'آخری میچ']	8
2019-10-08 16:15:17	UrduPoint	"پاکستان اور سری لنکا کے درمیان تیسرا اور آخری ٹی ٹونٹی انٹرنیشنل کرکٹ میچ ( کل ) کھیلا جائے گا

سری لنکن ٹیم کو پاکستان کے خلاف سیریز میں 2-0 کی فیصلہ کن برتری حاصل، مہمان ... مزید"	ur	1	PakSrilanka	پاکستان سری لنکا تیسرا ٹی ٹونٹی انٹرنیشنل کرکٹ میچ کل کھیلا سری لنکن ٹیم پاکستان سیریز فیصلہ کن برتری مہم	['پاکستان', 'سری لنکا', 'درمیان', 'آخری ٹی ٹونٹی انٹرنیشنل کرکٹ میچ', 'سری لنکن ٹیم', 'پاکستان', 'خلاف سیریز', 'فیصلہ', 'برتری', 'حاصل مہمان']	8
2019-10-09 12:33:16	UrduPoint	"سری لنکن آل راﺅنڈ ر تھیسارا پریرا نے دورہ پاکستان سے انکار کرنے کی وجہ بتا دی 
کیریبئن لیگ کے دوران ڈینگی بخار ہوگیا،ڈاکٹر کی ایڈوائس پر آرام کررہا ہوں:آل راﺅنڈر"	ur	1	PakSrilanka	سری لنکن آل راﺅنڈ ر تھیسارا پریرا دورہ پاکستان کار بتا کیریبئن لیگ ڈینگی بخار ڈاکٹر ایڈوائس آرام آل راﺅنڈر	['سری لنکن آل راﺅنڈ ر تھیسارا پریرا', 'دورہ پاکستان', 'انکار', 'وجہ', 'کیریبئن لیگ', 'دوران ڈینگی بخار ہوگیاڈاکٹر', 'ایڈوائس', 'آرام کررہا ہوںآل راﺅنڈر']	8
2019-10-09 15:40:21	UrduPoint	"چھاتی کے سرطان کے حوالے سے پنک ربن ڈے

پاکستان کرکٹ بورڈ نے قذافی سٹیڈیم میں کھیلے جانیوالے پاک سری لنکن ٹی ٹونٹی سیریز کے تیسرے اور آخری میچ کو پنک ربن سے منصوب کردیا

میچ ... مزید"	ur	1	PakSrilanka	چھاتی سرطان حوالے پنک ربن ڈے پاکستان کرکٹ بورڈ قذافی سٹیڈیم کھیلے جانیوالے پاک سری لنکن ٹی ٹونٹی سیریز تیسرے آخری میچ پنک ربن منصوب میچ	['چھاتی', 'سرطان', 'حوالے', 'پنک ربن ڈے پاکستان کرکٹ بورڈ', 'قذافی سٹیڈیم', 'پاک سری لنکن ٹی ٹونٹی سیریز', 'آخری میچ', 'پنک ربن', 'میچ']	8
