DateTime	Source	Title	lang	search_keywords	Label	preprocessed_text	NounChunks	km_label
2019-10-07 13:42:27	ExpressNews	خیبر پختون خوا میں ڈینگی بے قابو، 24 گھنٹوں کے دوران مزید 39 مریض اسپتال میں داخل	ur	1	DengueFever	خیبر پختون خوا ڈینگی قابو گھنٹوں مریض اسپتال داخل	['خیبر پختون خوا', 'ڈینگی بے قابو گھنٹوں', 'دوران', 'مزید مریض اسپتال', 'داخل']	10
2019-10-07 13:42:27	UrduPoint	خیبر پختون خوا میں ڈینگی بے قابو، 24 گھنٹوں کے دوران مزید 39 مریض اسپتال میں داخل	ur	1	DengueFever	خیبر پختون خوا ڈینگی قابو گھنٹوں مریض اسپتال داخل	['خیبر پختون خوا', 'ڈینگی بے قابو گھنٹوں', 'دوران', 'مزید مریض اسپتال', 'داخل']	10
2019-10-07 13:46:06	UrduPoint	ڈی سی لاہورکا سروسز ہسپتال کا دورہ، ڈینگی انتظامات کا جائزہ لیا	ur	1	DengueFever	ڈی لاہورکا سروسز ہسپتال دورہ ڈینگی انتظامات جائزہ	['ڈی', 'سی لاہورکا سروسز ہسپتال', 'دورہ ڈینگی انتظامات', 'جائزہ']	1
2019-10-07 13:46:06	UrduPoint	ڈینگی سے چھٹکارا حاصل کرنے کے لیے تمام محکموں اور عوام کا تعاون ضروری ہے، ڈی سی لاہور	ur	1	DengueFever	ڈینگی چھٹکارا محکموں عوام تعاون ڈی لاہور	['ڈینگی', 'چھٹکارا', 'محکموں', 'عوام', 'تعاون', 'ڈی', 'سی لاہور']	1
2019-10-07 13:46:08	UrduPoint	ایڈیشنل ڈپٹی کمشنر اور اسسٹنٹ کمشنرز کے انسداد ڈینگی اور صفائی مہم بارے دورے	ur	1	DengueFever	ایڈیشنل ڈپٹی کمشنر اسسٹنٹ کمشنرز انسداد ڈینگی صفائی مہم دورے	['ایڈیشنل', 'ڈپٹی کمشنر', 'اسسٹنٹ کمشنرز', 'انسداد ڈینگی', 'صفائی مہم بارے دورے']	11
2019-10-07 13:55:27	UrduPoint	آزادکشمیر میں 1085لوگ ڈینگی سے متاثر ہوئے، کوآرڈنیٹر نیشنل پروگرام وڈائریکٹر سی ڈی سی	ur	1	DengueFever	آزادکشمیر لوگ ڈینگی متاثر کوآرڈنیٹر نیشنل پروگرام وڈائریکٹر ڈی	['آزادکشمیر', 'لوگ ڈینگی', 'کوآرڈنیٹر نیشنل پروگرام وڈائریکٹر', 'سی ڈی']	1
2019-10-07 13:57:24	UrduPoint	عوام الناس میں ڈینگی مچھر کے ممکنہ مضراثرات او راس سے بچاؤ بارے آگہی سیمینار کا انعقاد	ur	1	DengueFever	عوام الناس ڈینگی مچھر ممکنہ مضراثرات او راس بچاؤ آگہی سیمینار انعقاد	['عوام الناس', 'ڈینگی مچھر', 'ممکنہ مضراثرات او راس', 'بچاؤ بارے', 'آگہی سیمینار', 'انعقاد']	2
2019-10-07 13:59:16	UrduPoint	چیچہ وطنی، ڈینگی کے خاتمہ کیلئے اقدامات ہم سب کی ذمہ داری ہے،صوبائی سیکرٹری سوشل ویلفیئر عنبرین رضا	ur	1	DengueFever	چیچہ وطنی ڈینگی خاتمہ کیلئے اقدامات ذمہ داری صوبائی سیکرٹری سوشل ویلفیئر عنبرین رضا	['چیچہ وطنی ڈینگی', 'خاتمہ', 'اقدامات', 'ذمہ داری', 'ہےصوبائی سیکرٹری', 'سوشل ویلفیئر عنبرین رضا']	12
2019-10-07 14:26:51	UrduPoint	"صوبائی وزیر صحت ڈاکٹر یاسمین راشد کا ہولی فیملی ہسپتال میں ڈینگی آئوٹ ڈور کا دورہ، 

ڈینگی کے شکار مریضوں کی عیادت و طبی سہولیات کا جائزہ لیا"	ur	1	DengueFever	صوبائی وزیر صحت ڈاکٹر یاسمین راشد ہولی فیملی ہسپتال ڈینگی آئوٹ ڈور دورہ ڈینگی شکار مریضوں عیادت و طبی سہولیات جائزہ	['صوبائی وزیر صحت ڈاکٹر یاسمین راشد', 'ہولی فیملی ہسپتال', 'ڈینگی آئوٹ ڈور', 'دورہ ڈینگی', 'شکار مریضوں', 'عیادت', 'طبی سہولیات', 'جائزہ']	9
2019-10-07 15:27:01	UrduPoint	ڈینگی ایک جان لیواء مرض ہے ڈینگی سے گھبرانے کی نہیں احیتاط کی ضرورت ہے	ur	1	DengueFever	ڈینگی جان لیواء مرض ڈینگی گھبرانے احیتاط	['ڈینگی', 'جان لیواء مرض', 'ڈینگی', 'احیتاط', 'ضرورت']	2
2019-10-07 15:31:04	UrduPoint	حکومت ڈینگی کو کنٹرول کرنے کیلئے بھاری فنڈز خرچ کر رہی ہے جس کا مقصد شہریوں کو اس مرض سے محفوظ بنانا ہے	ur	1	DengueFever	حکومت ڈینگی کنٹرول کیلئے بھاری فنڈز خرچ مقصد شہریوں مرض محفوظ بنانا	['حکومت ڈینگی', 'کنٹرول', 'بھاری فنڈز خرچ', 'مقصد شہریوں', 'مرض']	2
2019-10-07 15:36:33	Voice Of America	ڈینگی کے مریضوں کی تعداد 23 ہزار سے بڑھ گئی	ur	1	DengueFever	ڈینگی مریضوں تعداد ہزار بڑھ	['ڈینگی', 'مریضوں', 'تعداد']	10
2019-10-07 17:00:44	UrduPoint	لاہور: سرکاری ہسپتالوں میں زیر علاج مزید تین مریضوں میں ڈینگی وائرس کی تصدیق	ur	1	DengueFever	لاہور سرکاری ہسپتالوں زیر علاج تین مریضوں ڈینگی وائرس تصدیق	['لاہور', 'سرکاری ہسپتالوں', 'زیر علاج', 'مریضوں', 'ڈینگی وائرس', 'تصدیق']	9
2019-10-07 17:05:28	UrduPoint	"ڈینگی بے قا بو حکومتی اقدامات افسران کے تبادلوں تک محدود،حکومت نے جس طرح صحت کے بجٹ میں کمی کی تھی اس کا خمیازہ آج عوام بھگت رہے ہیں،ایم ساجد عباسی
ڈیل ہوئی ہے اور نہ کریں ... مزید"	ur	1	DengueFever	ڈینگی قا بو حکومتی اقدامات افسران تبادل وں محدود حکومت صحت بجٹ کمی خمیازہ آج عوام بھگت ایم ساجد عباسی ڈیل	['ڈینگی بے قا بو', 'حکومتی اقدامات افسران', 'تبادلوں', 'محدودحکومت', 'طرح صحت', 'بجٹ', 'کمی', 'خمیازہ آج عوام', 'ہیںایم ساجد عباسی ڈیل']	9
2019-10-07 18:06:15	UrduPoint	ضلع چنیوٹ ڈینگی کے خطرہ سے کافی حد تک محفوظ ہے، ڈپٹی کمشنر سید امان انور قدوائی	ur	1	DengueFever	ضلع چنیوٹ ڈینگی خطرہ فی حد محفوظ ڈپٹی کمشنر سید امان انور قدوائی	['ضلع چنیوٹ ڈینگی', 'خطرہ', 'حد', 'ڈپٹی کمشنر سید امان انور قدوائی']	11
2019-10-07 18:52:49	UrduPoint	"ڈینگی  مریضوںکیلئے صحت کی بہترین سہولیات فراہم کر رہے ہیں،یاسمین راشد


ہسپتالوںمیں اضافی بیڈز کے ساتھ ساتھ ڈاکٹروںاور پیرا میڈیکل سٹاف کی تعیناتی بھی یقینی بنائی جا ... مزید"	ur	1	DengueFever	ڈینگی مریضوںکیلئے صحت بہترین سہولیات فراہم یاسمین راشد ہسپتالوں اضافی بیڈز ڈاکٹروںاور پیرا میڈیکل سٹاف تعیناتی یقینی بنائی	['ڈینگی مریضوںکیلئے صحت', 'بہترین سہولیات', 'ہیںیاسمین راشد ہسپتالوںمیں', 'اضافی بیڈز', 'ساتھ ساتھ', 'ڈاکٹروںاور پیرا میڈیکل سٹاف', 'تعیناتی']	9
2019-10-07 18:54:17	UrduPoint	"آل پاکستان پرائیویٹ سکولز مینجمنٹ کے 10 رکنی وفد کی  ڈپٹی کمشنر راولپنڈی سے ملاقات
سیف اللہ ڈوگر نے ضلعی انتظامیہ راولپنڈی کو ڈینگی کی تشخیص کیلئے مشین کا عطیہ کردیا
۷ملاقات ... مزید"	ur	1	DengueFever	آل پاکستان پرائیویٹ سکولز مینجمنٹ رکنی وفد ڈپٹی کمشنر راولپنڈی ملاقات سیف اللہ ڈوگر ضلعی انتظامیہ راولپنڈی ڈینگی تشخیص کیلئے مشین عطیہ ۷ملاقات	['آل پاکستان پرائیویٹ سکولز مینجمنٹ', 'رکنی وفد', 'ڈپٹی کمشنر راولپنڈی', 'ملاقات سیف اللہ ڈوگر', 'ضلعی انتظامیہ راولپنڈی', 'ڈینگی', 'تشخیص', 'مشین', 'عطیہ', '۷ملاقات']	11
2019-10-07 18:54:18	UrduPoint	راولپنڈی ویسٹ مینجمنٹ کمپنی اور البائراک کی صفائی و ڈینگی سے آگاہی مہم جاری	ur	1	DengueFever	راولپنڈی ویسٹ مینجمنٹ کمپنی البائراک صفائی و ڈینگی آگاہی مہم جاری	['راولپنڈی ویسٹ مینجمنٹ کمپنی', 'البائراک', 'صفائی', 'ڈینگی', 'آگاہی مہم']	5
2019-10-07 18:54:18	UrduPoint	"آل پاکستان پرائیویٹ سکولز مینجمنٹ کے 10 رکنی وفد کی  ڈپٹی کمشنر راولپنڈی سے ملاقات

سیف اللہ ڈوگر نے ضلعی انتظامیہ راولپنڈی کو ڈینگی کی تشخیص کیلئے مشین کا عطیہ کردیا
۷ملاقات ... مزید"	ur	1	DengueFever	آل پاکستان پرائیویٹ سکولز مینجمنٹ رکنی وفد ڈپٹی کمشنر راولپنڈی ملاقات سیف اللہ ڈوگر ضلعی انتظامیہ راولپنڈی ڈینگی تشخیص کیلئے مشین عطیہ ۷ملاقات	['آل پاکستان پرائیویٹ سکولز مینجمنٹ', 'رکنی وفد', 'ڈپٹی کمشنر راولپنڈی', 'ملاقات سیف اللہ ڈوگر', 'ضلعی انتظامیہ راولپنڈی', 'ڈینگی', 'تشخیص', 'مشین', 'عطیہ', '۷ملاقات']	11
2019-10-08 05:30:20	UrduPoint	خیبر پختو نخوا میں ڈینگی سے متاثرہ افراد کی تعداد 4,522 ہو گئی	ur	1	DengueFever	خیبر پختو نخوا ڈینگی متاثرہ افراد تعداد	['خیبر پختو نخوا', 'ڈینگی', 'متاثرہ افراد', 'تعداد']	10
2019-10-08 07:55:23	UrduPoint	"پرویز مشرف غداری کیس ،وفاقی حکومت نے جسٹس وقار احمد سیٹھ کو خصوصی عدالت کا نیا سربراہ مقرر کر دیا 
پرویز مشرف کے وکیل رضا بشیر ڈینگی کا شکار ہوگئے، التواء کی درخواست دائر ... مزید"	ur	1	DengueFever	پرویز مشرف غداری کیس وفاقی حکومت جسٹس وقار احمد سیٹھ خصوصی عدالت نیا سربراہ مقرر پرویز مشرف وکیل رضا بشیر ڈینگی شکار ہوگئے التواء درخواست دائر	['پرویز مشرف', 'غداری کیس', 'وفاقی حکومت', 'جسٹس وقار احمد سیٹھ', 'خصوصی عدالت', 'نیا سربراہ', 'پرویز مشرف', 'وکیل رضا بشیر ڈینگی', 'شکار', 'التواء', 'درخواست']	2
2019-10-08 08:29:05	UrduPoint	"راولپنڈی اسلام آباد میں ڈینگی کی صورتحال کا جائزہ لینے کیلئے وفاقی سیکرٹری صحت کی زیرصدارت اجلاس
مؤثر اقدامات کی وجہ سے صورتحال قابو میں ہے اور ڈینگی کے تشخیص شدہ مریضوں ... مزید"	ur	1	DengueFever	راولپنڈی اسلام آباد ڈینگی حال جائزہ لینے کیلئے وفاقی سیکرٹری صحت زیر صدارت اجلاس مؤثر اقدامات حال قابو ڈینگی تشخیص شدہ مریضوں	['راولپنڈی اسلام آباد', 'ڈینگی', 'صورتحال', 'جائزہ', 'وفاقی سیکرٹری صحت', 'زیرصدارت اجلاس', 'مؤثر اقدامات', 'وجہ', 'صورتحال قابو', 'ڈینگی', 'تشخیص', 'شدہ مریضوں']	12
2019-10-08 08:35:39	UrduPoint	"پنجاب حکومت نے ڈینگی کے خاتمہ کیلئے کمر کس لی ہے‘آصف محمود
سرگودھا میں ڈینگی مچھر کے ممکنہ مضراثرات او راس سے بچائو بارے آگاہی سیمینارسے مشیر وزیراعلی کا خطاب"	ur	1	DengueFever	پنجاب حکومت ڈینگی خاتمہ کیلئے کمر آصف محمود سرگودھا ڈینگی مچھر ممکنہ مضراثرات او راس بچائو آگاہی سیمینارسے مشیر وزیر اعلی خطاب	['پنجاب حکومت', 'ڈینگی', 'خاتمہ', 'کمر', 'ہےآصف محمود سرگودھا', 'ڈینگی مچھر', 'ممکنہ مضراثرات او راس', 'بچائو بارے', 'آگاہی سیمینارسے مشیر وزیراعلی', 'خطاب']	2
2019-10-08 10:00:21	UrduPoint	"ڈینگی پر قابو پانے کے لیے ہر ممکن حکمت عملی اپنائی جا رہی ہے‘کمشنر راولپنڈی
ڈینگی ماہرین کی سفارشات پر ان یونین کونسلوں پر کیس رسپانس کے ذریعے بڑے پیمانے پر فوگنگ اور ... مزید"	ur	1	DengueFever	ڈینگی قابو پانے ممکن حکمت عملی اپنائی کمشنر راولپنڈی ڈینگی ماہرین سفارشات یونین کونسلوں کیس رسپانس بڑے پیمانے فوگنگ	['ڈینگی', 'قابو', 'ممکن حکمت', 'ہےکمشنر راولپنڈی ڈینگی ماہرین', 'سفارشات', 'یونین کونسلوں', 'کیس رسپانس', 'ذریعے', 'بڑے پیمانے', 'فوگنگ']	11
2019-10-08 10:45:20	UrduPoint	"جڑواں شہر کے موثر اقدامات کی وجہ سے ڈینگی کی صورتحال قابو میں ہے ،سیکرٹری صحت 
افسران ایمانداری لگن اور جزبے سے اپنے کام کو سر انجام دیں،آفیشل بزنس کو روزانہ کی بنیاد ... مزید"	ur	1	DengueFever	جڑواں شہر موثر اقدامات ڈینگی حال قابو سیکرٹری صحت افسران ایمانداری لگن جزبے کام سر انجام آفیشل بزنس روزانہ بنیاد	['جڑواں شہر', 'موثر اقدامات', 'وجہ', 'ڈینگی', 'صورتحال قابو', 'سیکرٹری صحت افسران', 'ایمانداری لگن', 'جزبے', 'کام', 'سر انجام دیںآفیشل بزنس', 'بنیاد']	12
2019-10-08 10:50:17	NawaeWaqt	ملک بھر میں ڈینگی کی بڑھتی ہوئی وبا کے خلاف پنجاب اسمبلی میں قرارداد جمع	ur	1	DengueFever	ملک ڈینگی بڑھتی وبا پنجاب اسمبلی قرار داد جمع	['ملک', 'ڈینگی', 'وبا', 'خلاف', 'پنجاب اسمبلی', 'قرارداد']	2
2019-10-08 10:50:17	UrduPoint	ملک بھر میں ڈینگی کی بڑھتی ہوئی وبا کے خلاف پنجاب اسمبلی میں قرارداد جمع	ur	1	DengueFever	ملک ڈینگی بڑھتی وبا پنجاب اسمبلی قرار داد جمع	['ملک', 'ڈینگی', 'وبا', 'خلاف', 'پنجاب اسمبلی', 'قرارداد']	2
2019-10-08 10:50:18	UrduPoint	"ڈینگی صحت کے ساتھ سوشل مسئلہ بھی ہے، قابو پانے کیلئے کمیونٹی کی شرکت لازم ہے
ْڈینگی سے بچنے کیلئے لوگ احتیاطی تدابیر پر عمل کریں، انسٹی ٹیوٹ آف پبلک ہیلتھ کے سٹوڈنٹس"	ur	1	DengueFever	ڈینگی صحت سوشل مسئلہ قابو پانے کیلئے کمیونٹی شرکت لازم ْڈینگی بچنے کیلئے لوگ احتیاطی تدابیر عمل انسٹی ٹیوٹ آف پبلک ہیلتھ سٹوڈنٹس	['ڈینگی صحت', 'ساتھ', 'سوشل مسئلہ', 'قابو', 'کمیونٹی', 'شرکت لازم', 'ْڈینگی', 'لوگ', 'احتیاطی تدابیر', 'عمل', 'انسٹی ٹیوٹ آف پبلک ہیلتھ', 'سٹوڈنٹس']	9
2019-10-08 11:40:27	UrduPoint	ڈینگی کنٹرول کرنے کیلئے موثر اقدامات نہ کرنے کیخلاف درخواست پر پنجاب حکومت سے رپورٹ طلب	ur	1	DengueFever	ڈینگی کنٹرول کیلئے موثر اقدامات کیخلاف درخواست پنجاب حکومت رپورٹ طلب	['ڈینگی کنٹرول', 'موثر اقدامات', 'درخواست', 'پنجاب حکومت', 'رپورٹ طلب']	2
2019-10-08 11:45:33	UrduPoint	آر ایم یو اور یونیورسٹی آف جارجیا جلد ہی ڈینگی ماڈلنگ شروع کرے گی	ur	1	DengueFever	آر ایم یو یونیورسٹی آف جارجیا جلد ڈینگی ماڈلنگ شروع	['آر ایم یو', 'یونیورسٹی آف جارجیا', 'ڈینگی ماڈلنگ شروع']	2
2019-10-08 12:23:29	UrduPoint	ڈینگی پر قابو پانے کے لیے ہر ممکن حکمت عملی اپنائی جا رہی ہے،کمشنر راولپنڈی ڈویژن	ur	1	DengueFever	ڈینگی قابو پانے ممکن حکمت عملی اپنائی کمشنر راولپنڈی ڈویژن	['ڈینگی', 'قابو', 'ممکن حکمت', 'ہےکمشنر راولپنڈی ڈویژن']	11
2019-10-08 12:30:38	UrduPoint	ضلعی انتظامیہ لاہور نے گزشتہ روز کی ڈینگی کی رپورٹ جاری کردی	ur	1	DengueFever	ضلعی انتظامیہ لاہور روز ڈینگی رپورٹ جاری	['ضلعی انتظامیہ لاہور', 'گزشتہ روز', 'ڈینگی', 'رپورٹ', 'جاری کردی']	5
2019-10-08 12:34:20	UrduPoint	اربن یونین کونسلز میں آنے والے کھیتوں میں بھی ڈینگی سرویلنس کی جائے، عامرخٹک	ur	1	DengueFever	اربن یونین کونسلز آنے کھیتوں ڈینگی سرویلنس عامرخٹک	['اربن یونین کونسلز', 'کھیتوں', 'ڈینگی سرویلنس', 'عامرخٹک']	2
2019-10-08 12:42:06	UrduPoint	چکوال ،چمکیلی دھوپ نکلتے ہی ڈینگی کے وار مزید بڑھ گئے	ur	1	DengueFever	چکوال چمکیلی دھوپ نکلتے ڈینگی وار بڑھ	['چکوال', 'چمکیلی دھوپ', 'ڈینگی', 'وار']	2
2019-10-08 13:42:48	UrduPoint	وہاڑی۔ڈینگی سے بچاؤ کی ٹیمیں گھر گھر جا کر سرولنس کر رہی ہیں،سی ای او ہیلتھ ڈاکٹر ارشد ملک	ur	1	DengueFever	وہاڑی ڈینگی بچاؤ ٹیمیں گھر گھر سرولنس ای او ہیلتھ ڈاکٹر ارشد ملک	['وہاڑی۔ڈینگی', 'بچاؤ', 'ٹیمیں گھر گھر', 'سرولنس', 'ہیںسی ای او ہیلتھ ڈاکٹر ارشد ملک']	2
2019-10-08 13:42:49	UrduPoint	ڈینگی سے بچنے کیلئے لوگ اپنے گھروں میں ڈینگی ہاٹ سپاٹس ختم کریں، ڈاکٹر زرفشاں طاہر	ur	1	DengueFever	ڈینگی بچنے کیلئے لوگ گھروں ڈینگی ہاٹ سپاٹس ڈاکٹر زرفشاں طاہر	['ڈینگی', 'لوگ', 'گھروں', 'ڈینگی ہاٹ سپاٹس', 'ڈاکٹر زرفشاں طاہر']	2
2019-10-08 13:45:24	UrduPoint	نیشنل ہائی ویز اینڈ موٹروے پولیس کی جانب سے موٹروے پولیس افسران و ملازمان کے لئے ڈینگی سے بچاؤ سے متعلق سیمینار	ur	1	DengueFever	نیشنل ہائی ویز اینڈ موٹروے پولیس جانب موٹروے پولیس افسران و ملازمان ڈینگی بچاؤ متعلق سیمینار	['نیشنل ہائی ویز اینڈ موٹروے پولیس', 'جانب', 'موٹروے پولیس افسران', 'ملازمان', 'لئے ڈینگی', 'بچاؤ', 'متعلق سیمینار']	2
2019-10-08 13:45:24	UrduPoint	سیکرٹری ٹرانسپورٹ اور ڈپٹی کمشنر شیخوپورہ کی زیر صدارت انسداد ڈینگی کے حوالے سے اہم اجلاس	ur	1	DengueFever	سیکرٹری ٹرانسپورٹ ڈپٹی کمشنر شیخوپورہ زیر صدارت انسداد ڈینگی حوالے اہم اجلاس	['سیکرٹری ٹرانسپورٹ', 'ڈپٹی کمشنر شیخوپورہ', 'زیر صدارت انسداد ڈینگی', 'حوالے', 'اہم اجلاس']	12
2019-10-08 13:55:09	UrduPoint	جھنگ ،ضلع بھر میں انسداد ڈینگی اقدامات کو مزید تیز کر دیاگیا	ur	1	DengueFever	جھنگ ضلع انسداد ڈینگی اقدامات تیز	['جھنگ ضلع', 'انسداد ڈینگی اقدامات']	2
2019-10-08 14:01:13	UrduPoint	خانیوال۔ ڈینگی کے خاتمہ کیلئے محکمہ صحت اور دیگر سرکاری محکمہ جات کی ٹیمیں سرتوڑ کوششیں کر یں، ڈپٹی کمشنر اشفاق احمد چودھری	ur	1	DengueFever	خانیوال ڈینگی خاتمہ کیلئے محکمہ صحت دیگر سرکاری محکمہ جات ٹیمیں سرتوڑ کوششیں یں ڈپٹی کمشنر اشفاق احمد چودھری	['خانیوال۔ ڈینگی', 'خاتمہ', 'محکمہ صحت', 'دیگر', 'سرکاری محکمہ جات', 'ٹیمیں سرتوڑ کوششیں', 'ڈپٹی کمشنر اشفاق احمد چودھری']	9
2019-10-08 14:02:08	UrduPoint	چنیوٹ۔ڈینگی سے محفوظ رہنے کیلئے شہریوں کا تعاون اور کردار کسی بھی صورت نظر انداز نہیں کیا جا سکتا ، ڈپٹی کمشنر سید امان انور قدوائی	ur	1	DengueFever	چنیوٹ ڈینگی محفوظ کیلئے شہریوں تعاون کردار نظر انداز ڈپٹی کمشنر سید امان انور قدوائی	['چنیوٹ۔ڈینگی', 'شہریوں', 'تعاون', 'کردار', 'صورت نظر انداز', 'ڈپٹی کمشنر سید امان انور قدوائی']	11
2019-10-08 14:02:08	UrduPoint	چنیوٹ،سپیشل ایجوکیشن سکول میںڈینگی سے آگاہی بارے سیمینار کا انعقاد	ur	1	DengueFever	چنیوٹ سپیشل ایجوکیشن سکول میںڈینگی آگاہی سیمینار انعقاد	['چنیوٹسپیشل ایجوکیشن سکول میںڈینگی', 'آگاہی بارے سیمینار', 'انعقاد']	2
2019-10-08 14:31:00	UrduPoint	ڈی سی لاہور کی ہدایت پرافسران کے فیلڈ میں ڈینگی کے حوالے سے دورے	ur	1	DengueFever	ڈی لاہور ہدایت پرافسران فیلڈ ڈینگی حوالے دورے	['ڈی', 'سی لاہور', 'ہدایت پرافسران', 'فیلڈ', 'ڈینگی', 'حوالے', 'دورے']	1
2019-10-08 14:31:00	UrduPoint	ضلعی انتظامیہ نے ڈینگی کی رپورٹ جاری کردی	ur	1	DengueFever	ضلعی انتظامیہ ڈینگی رپورٹ جاری	['ضلعی انتظامیہ', 'ڈینگی', 'رپورٹ', 'جاری کردی']	5
2019-10-08 14:32:08	UrduPoint	ڈینگی لاروا کی تلفی میں غفلت برتنے پر محکمانہ کارروائی عمل میں لائی جائے گی ، عاصمہ اعجازچیمہ	ur	1	DengueFever	ڈینگی لاروا تلفی غفلت برتنے محکمانہ کارروائی عمل عاصمہ اعجازچیمہ	['ڈینگی لاروا', 'تلفی', 'غفلت', 'محکمانہ کارروائی عمل', 'عاصمہ اعجازچیمہ']	0
2019-10-08 14:32:08	UrduPoint	سیکرٹری ٹرانسپورٹ سیداسدرحمن گیلانی کی زیر صدارت انسداد ڈینگی بارے اعلی سطحی اجلاس	ur	1	DengueFever	سیکرٹری ٹرانسپورٹ سیداسدرحمن گیلانی زیر صدارت انسداد ڈینگی اعلی سطحی اجلاس	['سیکرٹری ٹرانسپورٹ سیداسدرحمن گیلانی', 'زیر صدارت انسداد ڈینگی بارے', 'اعلی سطحی اجلاس']	12
2019-10-08 14:55:59	UrduPoint	"خیبرپختونخوا اور پنجاب کے عوام ڈینگی کے رحم و کرم پر 
خیبرپختونخوا میں ڈینگی مریضوں کی تعداد ساڑھے چار ہزار ،پنجاب میں ساڑھے پانچ ہزار تک پہنچ گئی"	ur	1	DengueFever	خیبر پختونخوا پنجاب عوام ڈینگی رحم و کرم خیبر پختونخوا ڈینگی مریضوں تعداد ساڑھے چار ہزار پنجاب ساڑھے پانچ ہزار پہنچ	['خیبرپختونخوا', 'پنجاب', 'عوام ڈینگی', 'رحم', 'کرم', 'خیبرپختونخوا', 'ڈینگی مریضوں', 'تعداد', 'پنجاب']	10
2019-10-08 15:45:07	UrduPoint	"نیشنل ہائی ویز اینڈ موٹروے پولیس کا ڈینگی سے آگاہی کے متعلق سیمینار کا انعقاد

احتیاطی تدابیر اپنا کر ڈینگی پر قابو پایا جا سکتا ہے ،ڈی آئی جی موٹرویز اشفاق احمد
’ ... مزید"	ur	1	DengueFever	نیشنل ہائی ویز اینڈ موٹروے پولیس ڈینگی آگاہی متعلق سیمینار انعقاد احتیاطی تدابیر ڈینگی قابو ڈی آئی جی موٹرویز اشفاق احمد	['نیشنل ہائی ویز اینڈ موٹروے پولیس', 'ڈینگی', 'آگاہی', 'متعلق سیمینار', 'انعقاد', 'احتیاطی تدابیر', 'ڈینگی', 'قابو', 'ڈی آئی جی موٹرویز اشفاق احمد ’']	2
