DateTime	Source	Title	lang	search_keywords	Label	preprocessed_text	NounChunks	km_label
2019-09-20 00:54:51	UrduPoint	"سی پیک منصوبہ ختم،آئی ایم ایف کی شرائط پرعملدرآمد شروع
امریکہ کی خوشنودی کے لیے پاکستانی مفاد پسِ پشت ڈال دیا گیا"	ur	1	CPEC	پیک منصوبہ ایم ایف شرائط عمل درآمد شروع امریکہ خوشنودی پاکستانی مفاد پس پشت ڈال	['سی پیک منصوبہ ختمآئی ایم ایف', 'شرائط پرعملدرآمد شروع امریکہ', 'خوشنودی', 'پاکستانی مفاد پسِ پشت']	3
2019-09-20 05:45:20	UrduPoint	حکومت نے سی پیک کے تحت اکانامک زونز پر توجہ مرکوز رکھی ہے‘ رشکئی اکنامک زون گراونڈ بریکینگ کے لیے مکمل ہے‘ آئندہ ماہ افتتاح کردیا جائے گا، وفاقی وزیر برائے منصوبہ بندی ... مزید	ur	1	CPEC	حکومت پیک اکانامک زونز توجہ مرکوز رشکئی اکنامک زون گراونڈ بریکینگ آئندہ ماہ افتتاح وفاقی وزیر برائے منصوبہ بندی	['حکومت', 'سی پیک', 'تحت اکانامک زونز', 'توجہ', 'رشکئی اکنامک زون گراونڈ بریکینگ', 'آئندہ ماہ افتتاح', 'وفاقی وزیر', 'منصوبہ بندی']	4
2019-09-20 18:53:21	UrduPoint	سی پیک کاموجودہ مرحلہ پاکستانی عوام کیلئے معاشی فوائد لے کر آئے گا، سی پیک اب دوسرے مرحلہ میں داخل ہو گیا ہے جس میں غربت کے خاتمہ، زراعت اور صنعتی تعاون پر توجہ دی جائے ... مزید	ur	1	CPEC	پیک کاموجودہ مرحلہ پاکستانی عوام کیلئے معاشی فوائد آئے پیک اب مرحلہ داخل غربت خاتمہ زراعت صنعتی تعاون توجہ	['سی پیک', 'کاموجودہ مرحلہ', 'پاکستانی عوام', 'معاشی فوائد', 'سی پیک', 'دوسرے مرحلہ', 'داخل', 'غربت', 'خاتمہ زراعت', 'صنعتی تعاون', 'توجہ']	3
2019-09-21 09:28:12	UrduPoint	"وزیر اعلیٰ خیبر پختونخوا محمود خان کا جمعہ کے روز چترال کا سرکاری دورہ
وزیر اعلیٰ نے بتایا کہ سی پیک کا متبادل روٹ چترل سے ہی ہو کر جائے گا، انہوں نے متاثرہ ریشن بجلی گھر ... مزید"	ur	1	CPEC	وزیر اعلی خیبر پختونخوا محمود خان جمعہ روز چترال سرکاری دورہ وزیر اعلی بتایا پیک متبادل روٹ چترل متاثرہ ریشن بجلی گھر	['وزیر', 'اعلیٰ خیبر پختونخوا محمود خان', 'جمعہ', 'روز چترال', 'سرکاری دورہ وزیر اعلیٰ', 'سی پیک', 'متبادل روٹ چترل', 'متاثرہ ریشن بجلی گھر']	4
2019-09-23 06:40:21	UrduPoint	غربت کی شرح میں کمی  سی پیک دوسرے مرحلے کی اہم ترجیحات میں شامل	ur	1	CPEC	غربت شرح کمی پیک مرحلے اہم ترجیحات شامل	['غربت', 'شرح', 'کمی', 'سی پیک', 'دوسرے مرحلے', 'اہم ترجیحات']	3
2019-09-23 06:40:21	UrduPoint	حکومت عوام کو ریلیف کی فراہمی کے لئے پر عزم ہے، سی پیک اتھارٹی	ur	1	CPEC	حکومت عوام ریلیف فراہمی عزم پیک اتھارٹی	['حکومت عوام', 'ریلیف', 'فراہمی', 'لئے', 'عزم', 'سی پیک اتھارٹی']	3
2019-09-24 06:20:17	UrduPoint	چین پاکستان اقتصادی راہداری منصوبہ کے دوسرے مرحلہ میں غربت کے خاتمے، زراعت اور صنعتی تعاون پر خصوصی توجہ دی جائے گی، حکام سی پیک اتھارٹی	ur	1	CPEC	چین پاکستان اقتصادی راہداری منصوبہ مرحلہ غربت خاتمے زراعت صنعتی تعاون خصوصی توجہ حکام پیک اتھارٹی	['چین پاکستان', 'اقتصادی راہداری منصوبہ', 'دوسرے مرحلہ', 'غربت', 'خاتمے زراعت', 'صنعتی تعاون', 'خصوصی توجہ', 'حکام', 'سی پیک اتھارٹی']	3
2019-10-07 11:01:26	UrduPoint	وزیر اعظم عمران خان کے دورہ چین سے دونوں ممالک کے مابین تعلقات کے نئے دور کا آغاز ہو گا سی پیک پر کام کی رفتار بڑھ جائے گی، شاہد رشید بٹ	ur	1	CPEC	وزیر اعظم عمران خان دورہ چین ممالک مابین تعلقات نئے دور آغاز پیک کام رفتار بڑھ شاہد رشید بٹ	['وزیر اعظم عمران خان', 'دورہ چین', 'ممالک', 'مابین تعلقات', 'نئے دور', 'آغاز', 'سی پیک', 'کام', 'رفتار', 'شاہد رشید']	4
2019-10-07 11:08:21	ExpressNews	صدارتی آرڈیننس کے ذریعے سی پیک اتھارٹی قائم کرنے کا فیصلہ	ur	1	CPEC	صدارتی آرڈیننس پیک اتھارٹی قائم فیصلہ	['صدارتی آرڈیننس', 'ذریعے', 'سی پیک اتھارٹی', 'فیصلہ']	3
2019-10-07 15:09:59	UrduPoint	"خیبرپختونخوا حکومت کی تمام متعلقہ محکموں کو ترقیاتی منصوبوںکی حتمی منصوبہ بندی مرتب کرنے کی ہدایت
صوبے کے زیادہ ترقیاتی منصوبوں کو پچھلی وفاقی دور حکومت میں سی پیک کے ... مزید"	ur	1	CPEC	خیبر پختونخوا حکومت متعلقہ محکموں ترقیاتی منصوبوںکی حتمی منصوبہ بندی مرتب ہدایت صوبے ترقیاتی منصوبوں پچھلی وفاقی دور حکومت پیک	['خیبرپختونخوا حکومت', 'متعلقہ محکموں', 'ترقیاتی منصوبوںکی', 'حتمی منصوبہ بندی', 'ہدایت صوبے', 'ترقیاتی منصوبوں', 'پچھلی وفاقی دور حکومت', 'سی پیک']	4
2019-10-07 15:52:35	UrduPoint	"وزیراعظم عمران خان کا دورہ چین سی پیک منصوبوں کے لئے بہت اہم ہے، حسن داد بٹ

چینی سرمایہ کاروں کا وفد جلد خیبر پختونخوا کے نئے قائم ہونے والے انڈسٹریل زونز کا دورہ کریں ... مزید"	ur	1	CPEC	وزیراعظم عمران خان دورہ چین پیک منصوبوں اہم حسن داد بٹ چینی سرمایہ کاروں وفد جلد خیبر پختونخوا نئے قائم انڈسٹریل زونز دورہ	['وزیراعظم عمران خان', 'دورہ چین', 'سی پیک منصوبوں', 'لئے', 'حسن داد', 'چینی سرمایہ کاروں', 'وفد', 'خیبر پختونخوا', 'انڈسٹریل زونز', 'دورہ']	4
2019-10-07 15:52:35	UrduPoint	چین پاکستان اقتصادی راہداری سے ملک میں توانائی کے شدید بحران پرقابو پانے میں مدد ملی ہے، حکام سی پیک اتھارٹی	ur	1	CPEC	چین پاکستان اقتصادی راہداری ملک انائی شدید بحران پرقابو پانے مدد ملی حکام پیک اتھارٹی	['چین پاکستان', 'اقتصادی راہداری', 'ملک', 'توانائی', 'شدید بحران پرقابو', 'مدد', 'حکام', 'سی پیک اتھارٹی']	3
2019-10-07 16:39:41	UrduPoint	"وزیراعظم عمران خان کے دورہ چین کے بعد چینی صدر بھارت جائیں گے: شاہ محمود قریشی
چین مطمئن ہے لیکن اپوزیشن بلاوجہ سی پیک کو ایشو بنا تی ہے،  پاکستان نے ایف اے ٹی ایف کو مطمئن ... مزید"	ur	1	CPEC	وزیراعظم عمران خان دورہ چین چینی صدر بھارت شاہ محمود قریشی چین مطمئن اپوزیشن بلاوجہ پیک ایشو تی پاکستان ایف ٹی ایف مطمئن	['وزیراعظم عمران خان', 'دورہ چین', 'بعد چینی صدر بھارت', 'شاہ محمود قریشی چین', 'اپوزیشن بلاوجہ', 'سی پیک', 'ایشو', 'پاکستان', 'ایف اے ٹی ایف']	4
2019-10-07 17:05:18	UrduPoint	"ض*کے سی آر پر وفاقی حکومت کی سردمہری اور ان کا رویہ قابل افسوس ہے،سعید غنی 
Gوزیر اعظم کے حالیہ دورے کے دوران ا سی پیک پر جو نکات رکھے گئے ہیں ، ان میں کے سی آر کو شامل نہ ... مزید"	ur	1	CPEC	ض آر وفاقی حکومت سردمہری رویہ قابل افسوس سعید غنی وزیر اعظم حالیہ دورے ا پیک نکات آر شامل	['ضکے', 'سی آر', 'وفاقی حکومت', 'سردمہری', 'رویہ', 'قابل افسوس', 'ہےسعید غنی وزیر اعظم', 'حالیہ دورے', 'دوران', 'سی پیک', 'نکات', 'سی آر']	4
2019-10-07 18:09:03	UrduPoint	"خطے میں مزید تنازع نہیں چاہتے، کوشش ہے سعودیہ اور ایران میں غلط فہماں دور ہوں، وزیر خارجہ 

سی پیک پر چین اور پاکستان دونوں مطمئن ہیں، ہم اگلے فیز کی جانب آگے بڑھ چکے ... مزید"	ur	1	CPEC	خطے تنازع کوشش سعودیہ ایران غلط فہماں دور وزیر خارجہ پیک چین پاکستان مطمئن فیز جانب آگے بڑھ چکے	['خطے', 'مزید تنازع', 'کوشش', 'سعودیہ', 'ایران', 'غلط فہماں دور', 'وزیر خارجہ', 'سی پیک', 'چین', 'پاکستان', 'اگلے فیز', 'جانب آگے']	4
2019-10-08 06:40:10	UrduPoint	"سی پیک کے پہلے مرحلے کی تکمیل سے پاکستان میں بنیادی ڈھانچے میں بہتری آئی ہے، 
منصوبے سے افغانستان، وسطی ایشیاء اور روس تک رسائی فراہم ہوگی
چینی سفیر یاؤچنگ کی اے پی پی ... مزید"	ur	1	CPEC	پیک مرحلے تکمیل پاکستان بنیادی ڈھانچے بہتری آئی منصوبے افغانستان وسطی ایشیاء روس رسائی فراہم ہوگی چینی سفیر یاؤچنگ پی پی	['سی پیک', 'پہلے مرحلے', 'تکمیل', 'پاکستان', 'بنیادی ڈھانچے', 'بہتری', 'منصوبے', 'افغانستان', 'وسطی ایشیاء', 'روس', 'رسائی', 'چینی سفیر یاؤچنگ', 'اے']	4
2019-10-08 06:40:10	UrduPoint	سی پیک سے کے تحت بلوچستان میں اقتصادی زونز کے قیام سے مقامی صنعت ترقی کرے گی، حکام سی پیک اتھارٹی	ur	1	CPEC	پیک بلوچستان اقتصادی زونز قیام مقامی صنعت ترقی حکام پیک اتھارٹی	['سی پیک', 'تحت بلوچستان', 'اقتصادی زونز', 'قیام', 'مقامی صنعت ترقی', 'حکام', 'سی پیک اتھارٹی']	3
2019-10-08 07:08:35	UrduPoint	سی پیک کے تحت بلوچستان کی تحصیل بوستان میں انڈسٹریل زون پر کام تیزی سے جاری	ur	1	CPEC	پیک بلوچستان تحصیل بوستان انڈسٹریل زون کام تیزی جاری	['سی پیک', 'تحت بلوچستان', 'تحصیل بوستان', 'انڈسٹریل زون', 'کام تیزی']	5
2019-10-08 07:08:36	UrduPoint	سی پیک سے متعلقہ منصوبوں میں70 ہزار پاکستانیوں کو روزگار ملا ، حکام سی پیک اتھارٹی	ur	1	CPEC	پیک متعلقہ منصوبوں ہزار پاکستانیوں روزگار ملا حکام پیک اتھارٹی	['سی پیک', 'متعلقہ منصوبوں', 'پاکستانیوں', 'روزگار', 'حکام', 'سی پیک اتھارٹی']	3
2019-10-08 07:20:52	ExpressNews	وزیراعظم سی پیک اتھارٹی کے چیئرپرسن مقرر، آرڈیننس جاری	ur	1	CPEC	وزیراعظم پیک اتھارٹی چیئرپرسن مقرر آرڈیننس جاری	['وزیراعظم', 'سی پیک اتھارٹی', 'چیئرپرسن', 'مقرر آرڈیننس']	3
2019-10-08 09:39:20	UrduPoint	"احسن اقبال نے سی پیک اتھارٹی کے آرڈیننس کو خلاف قانون قرار دیدیا 
سی پیک اتھارٹی کا قیام غیرقانونی اور پارلیمانی کمیٹی کی سفارشات کے منافی ہے، مسترد کرتے ہیں ، سیکرٹری ... مزید"	ur	1	CPEC	احسن اقبال پیک اتھارٹی آرڈیننس قانون قرار دیدیا پیک اتھارٹی قیام غیرقانونی پارلیمانی کمیٹی سفارشات منافی مسترد سیکرٹری	['احسن اقبال', 'سی پیک اتھارٹی', 'آرڈیننس', 'خلاف قانون قرار', 'سی پیک اتھارٹی', 'قیام', 'پارلیمانی کمیٹی', 'سفارشات', 'سیکرٹری']	3
2019-10-08 09:39:21	UrduPoint	"صدر مملکت عارف علوی نے سی پیک اتھارٹی آرڈیننس پر دستخط کردیئے
سی پیک اتھارٹی آرڈیننس کا اطلاق پورے پاکستان میں ہوگا ، وزیراعظم عمران خان اتھارٹی کے سربراہ ہوں گے"	ur	1	CPEC	صدر مملکت عارف علوی پیک اتھارٹی آرڈیننس دستخط پیک اتھارٹی آرڈیننس اطلاق پورے پاکستان وزیراعظم عمران خان اتھارٹی سربراہ	['صدر مملکت عارف علوی', 'سی پیک اتھارٹی آرڈیننس', 'دستخط کردیئے', 'سی پیک اتھارٹی آرڈیننس', 'اطلاق', 'پورے پاکستان', 'وزیراعظم عمران خان اتھارٹی', 'سربراہ']	3
2019-10-08 13:42:49	UrduPoint	پاکستان اور چین سی پیک کو معاشی و معاشی ترقی، صنعتی انقلاب اور جدید زراعتی نظام کے عمل انگیز کے طور پر استوار کرنے جا رہے ہیں، پاکستان اقتصادی سفارتکاری پر خصوصی توجہ ... مزید	ur	1	CPEC	پاکستان چین پیک معاشی و معاشی ترقی صنعتی انقلاب جدید زراعتی نظام عمل انگیز استوار پاکستان اقتصادی سفارتکاری خصوصی توجہ	['پاکستان', 'چین', 'سی پیک', 'معاشی ترقی', 'صنعتی انقلاب', 'جدید زراعتی نظام', 'عمل انگیز', 'طور', 'پاکستان', 'اقتصادی سفارتکاری', 'خصوصی توجہ']	4
2019-10-08 14:49:21	UrduPoint	"چین کی پاکستان کو قومی مفاد کے ایشو میں بھرپور تعاون کی یقین دہانی 
وزیراعظم اور چینی ہم منصب کے درمیان ملاقات،مقبوضہ کشمیر کی صورتحال اورسی پیک کے منصوبوں پرتبادلہ خیال،چینی ... مزید"	ur	1	CPEC	چین پاکستان قومی مفاد ایشو بھرپور تعاون یقین دہانی وزیراعظم چینی منصب ملاقات مقبوضہ کشمیر حال پیک منصوبوں تبادلہ خیال چینی	['چین', 'پاکستان', 'قومی مفاد', 'ایشو', 'بھرپور تعاون', 'یقین دہانی وزیراعظم', 'چینی', 'منصب', 'درمیان', 'ملاقاتمقبوضہ کشمیر', 'صورتحال', 'اورسی پیک', 'منصوبوں پرتبادلہ خیالچینی']	4
2019-10-08 15:40:54	UrduPoint	"وفاقی حکومت کی سردمہری اور ان کا رویہ قابل افسوس ہے، سعید غنی
سی پیک میں کے سی آر کو شامل نہ کرنا زیادتی کے مترادف ہے،صوبائی وزیر"	ur	1	CPEC	وفاقی حکومت سردمہری رویہ قابل افسوس سعید غنی پیک آر شامل زیادتی مترادف صوبائی وزیر	['وفاقی حکومت', 'سردمہری', 'رویہ', 'قابل افسوس', 'سعید غنی', 'سی پیک', 'سی آر', 'زیادتی', 'مترادف ہےصوبائی وزیر']	4
2019-10-08 15:59:06	UrduPoint	"کراچی سرکولر ریلوے پر وفاقی حکومت کی سردمہری قابل افسوس ہے،سعید غنی
حالیہ دورے کے دوران وزیراعظم نے سی پیک پر جو نکات رکھے گئے ہیں، ان میں کے سی آر کو شامل نہ کرنا صوبہ ... مزید"	ur	1	CPEC	کراچی سرکولر ریلوے وفاقی حکومت سردمہری قابل افسوس سعید غنی حالیہ دورے وزیراعظم پیک نکات آر شامل صوبہ	['کراچی سرکولر ریلوے', 'وفاقی حکومت', 'سردمہری قابل افسوس', 'ہےسعید غنی', 'حالیہ دورے', 'دوران وزیراعظم', 'سی پیک', 'نکات', 'سی آر', 'صوبہ']	4
2019-10-08 16:43:10	UrduPoint	وفاقی حکومت نے سی پیک اتھارٹی  بارے صدارتی آرڈیننس جاری کرکے شاندار اقدامات کئے،انوار الحق رامے	ur	1	CPEC	وفاقی حکومت پیک اتھارٹی صدارتی آرڈیننس جاری شاندار اقدامات انوار الحق رامے	['وفاقی حکومت', 'سی پیک اتھارٹی بارے', 'صدارتی آرڈیننس', 'جاری کرکے', 'شاندار اقدامات', 'کئےانوار الحق رامے']	3
2019-10-09 14:28:52	UrduPoint	"پاکستان اور چین نے سی پیک کے تحت اربوں ڈالر مالیت کے ایم ایل۔ ون منصوبے کو حتمی شکل دے دی ہے، 

کراچی سے پشاور تک ریلوے ٹریک کی لمبائی تقریبا 1800 کلومیٹر ہوگی اور نیا سگنلنگ ... مزید"	ur	1	CPEC	پاکستان چین پیک اربوں ڈالر مالیت ایم ایل ون منصوبے حتمی شکل کراچی پشاور ریلوے ٹریک لمبائی تقریبا کلو میٹر ہوگی نیا سگنلنگ	['پاکستان', 'چین', 'سی پیک', 'تحت اربوں ڈالر مالیت', 'ایم ایل۔ ون منصوبے', 'حتمی شکل', 'کراچی', 'پشاور', 'ریلوے ٹریک', 'لمبائی', 'نیا سگنلنگ']	4
2019-10-09 14:30:33	UrduPoint	"پاکستان اور چین قریبی دوست، شراکت دار اور آہنی برادرز ہیں، پاکستان غربت کے خاتمہ کیلئے چین کے تجربات سے استفادہ کرنا چاہتا ہے، 

سی پیک کی تکمیل موجودہ حکومت کی اولین ... مزید"	ur	1	CPEC	پاکستان چین قریبی دوست شراکت دار آہنی برادرز پاکستان غربت خاتمہ کیلئے چین تجربات استفادہ چاہتا پیک تکمیل موجودہ حکومت اولین	['پاکستان', 'چین', 'قریبی دوست شراکت دار', 'آہنی برادرز', 'پاکستان غربت', 'خاتمہ', 'چین', 'تجربات', 'استفادہ', 'سی پیک', 'تکمیل', 'موجودہ حکومت']	4
2019-10-10 09:31:52	UrduPoint	سی پیک کے دوسرے مرحلے کی تکمیل سے روزگار کے مواقع پیدا کرنے میں مدد ملے گی، حکام سی پیک اتھارٹی	ur	1	CPEC	پیک مرحلے تکمیل روزگار مواقع پیدا مدد ملے حکام پیک اتھارٹی	['سی پیک', 'دوسرے مرحلے', 'تکمیل', 'روزگار', 'مواقع پیدا', 'مدد', 'حکام', 'سی پیک اتھارٹی']	3
2019-10-11 06:53:51	UrduPoint	پاک چین صنعتی تعاون کو فروغ دینے کے لئے جامع فریم ورک تیار کیا جا رہا ہے، حکام سی پیک اتھارٹی	ur	1	CPEC	پاک چین صنعتی تعاون فروغ جامع فریم ورک تیار حکام پیک اتھارٹی	['پاک چین', 'صنعتی تعاون', 'فروغ', 'لئے', 'جامع فریم ورک', 'حکام', 'سی پیک اتھارٹی']	3
2019-10-11 06:53:51	UrduPoint	وزیراعظم کا دورہ چین سی پیک کے نئے منصوبوں میں مددگار ثابت ہوگا، حسن دائودبٹ	ur	1	CPEC	وزیراعظم دورہ چین پیک نئے منصوبوں مددگار ثابت حسن دائودبٹ	['وزیراعظم', 'دورہ چین', 'سی پیک', 'نئے منصوبوں', 'حسن دائودبٹ']	4
2019-10-11 06:53:51	UrduPoint	چین کے چیف پلانرکنگ ژی وانگ کا سی پیک کے تحت جاری منصوبوں کی معیاری اور بروقت تکمیل پر اطمینان کا اظہار	ur	1	CPEC	چین چیف پلانرکنگ ژی وانگ پیک جاری منصوبوں معیاری بروقت تکمیل اطمینان اظہار	['چین', 'چیف پلانرکنگ ژی وانگ', 'سی پیک', 'تحت', 'جاری منصوبوں', 'بروقت تکمیل', 'اطمینان', 'اظہار']	4
2019-10-09 14:29:00	Voice Of America	ترکی کی شام میں فوجی کارروائی کا آغاز	ur	1	TurkishArmy	ترکی شام فوجی کارروائی آغاز	['ترکی', 'شام', 'فوجی کارروائی', 'آغاز']	0
2019-10-09 14:29:47	Voice Of America	ترکی نے شام میں فوجی کارروائی کا آغاز کر دیا	ur	1	TurkishArmy	ترکی شام فوجی کارروائی آغاز	['ترکی', 'شام', 'فوجی کارروائی', 'آغاز']	0
2019-10-10 07:11:25	UrduPoint	"ترکی شام میں کرد جنگجوؤں کیخلاف فوجی کارروائی روک دے‘یورپی یونین
یورپی یونین شام میں مجوزہ ’’سیف زون‘‘ کے قیام کے لیے کوئی رقم نہیں دے گی"	ur	1	TurkishArmy	ترکی شام کرد جنگجوؤں کیخلاف فوجی کارروائی روک یورپی یونین یورپی یونین شام مجوزہ سیف زون قیام رقم	['ترکی شام', 'کرد جنگجوؤں کیخلاف فوجی کارروائی', 'دےیورپی یونین', 'یورپی یونین شام', 'مجوزہ ’’سیف زون', 'قیام', 'رقم']	0
2019-10-10 09:06:06	UrduPoint	"شام میں ترک فوجی کارروائی پر عالمی برادری چلا اٹھی
صدر سلامتی کونسل کا ترکی سے شہریوں کی جان ومال کا حفاظت یقینی بنانے اور تحمل کا مظاہرہ کرنے کا مطالبہ"	ur	1	TurkishArmy	شام ترک فوجی کارروائی عالمی برادری چلا اٹھی صدر سلامتی کونسل ترکی شہریوں جان ومال حفاظت یقینی بنانے تحمل مظاہرہ مطالبہ	['شام', 'ترک فوجی کارروائی', 'عالمی برادری', 'صدر', 'سلامتی کونسل', 'ترکی', 'شہریوں', 'جان ومال', 'حفاظت', 'تحمل', 'مظاہرہ', 'مطالبہ']	0
2019-10-10 09:06:06	UrduPoint	"ترکی کی فوجی کارروائی کے بعد شام میں بڑے پیمانے پرلوگوں کی نقل مکانی
ْ راس العین سے نقل مکانی کرنے والے افراد جنوبی علاقے الحسکہ کی طرف جنوب کی طرف جا رہے ہیں"	ur	1	TurkishArmy	ترکی فوجی کارروائی شام بڑے پیمانے پرلوگوں نقل مکانی ْ راس العین نقل مکانی افراد جنوبی علاقے الحسکہ جنوب	['ترکی', 'فوجی کارروائی', 'بعد شام', 'بڑے پیمانے پرلوگوں', 'نقل مکانی ْ راس العین', 'نقل مکانی', 'افراد', 'جنوبی علاقے الحسکہ', 'طرف جنوب', 'طرف']	0
2019-10-10 09:54:39	UrduPoint	عالمی برادری کیشام میں ترک فوجی کارروائی کی مذمت	ur	1	TurkishArmy	عالمی برادری کیشام ترک فوجی کارروائی مذمت	['عالمی برادری کیشام', 'ترک فوجی کارروائی', 'مذمت']	0
2019-10-10 13:33:37	Voice Of America	ترک فوجی کارروائی پر غور کے لئے اقوام متحدہ کا اجلاس آج	ur	1	TurkishArmy	ترک فوجی کارروائی غور اقوام متحدہ اجلاس آج	['ترک فوجی کارروائی', 'غور', 'لئے اقوام متحدہ', 'اجلاس آج']	0
2019-10-11 05:45:18	UrduPoint	سلامتی کونسل کے رکن یورپی ممالک کا ترکی سے شام میں فوجی کارروائی روکنے کا مطالبہ	ur	1	TurkishArmy	سلامتی کونسل رکن یورپی ممالک ترکی شام فوجی کارروائی روکنے مطالبہ	['سلامتی کونسل', 'رکن', 'یورپی ممالک', 'ترکی', 'شام', 'فوجی کارروائی', 'مطالبہ']	0
2019-09-20 08:15:16	UrduPoint	کشمیریوں سے اظہار یکجہتی کی قرارداد پنجاب اسمبلی میں جمع	ur	1	Kashmir	کشمیریوں اظہار یکجہتی قرار داد پنجاب اسمبلی جمع	['کشمیریوں', 'اظہار یکجہتی', 'قرارداد', 'پنجاب اسمبلی']	7
2019-09-20 09:43:47	UrduPoint	سیالکوٹ، کشمیریوں سے اظہار یکجہتی کے لیے ریلی	ur	1	Kashmir	سیالکوٹ کشمیریوں اظہار یکجہتی ریلی	['سیالکوٹ کشمیریوں', 'اظہار یکجہتی', 'ریلی']	7
